{
    "task": "Visualisation",
    "deployment": "development",
    "name": "DARIAH-DE Geo-Browser",
    "logo": "dariah.svg",
    "homepage": "https://de.dariah.eu/en/geobrowser",
    "location": "Göttingen, Germany",
    "creators": "Ubbo Veentjer (SUB Göttingen) and Stefan E. Funk (SUB Göttingen)",
    "contact": {
        "person": "Stefan E Funk",
        "email": "support@de.dariah.eu"
    },
    "version": "v3.6-BETA",
    "authentication": "DARIAH AAI (restricted resources), none (public resources)",
    "description": "The DARIAH-DE Geo-Browser allows a comparative visualization of several requests and facilitates the representation of data and their visualization in a correlation of geographic spatial relations at corresponding points of time and sequences. Thus, researchers can analyze space-time relations of data and collections of source material and simultaneously establish correlations between them. This sample dataset for the Geo-Browser shows publishing dates and locations of works by Friedrich Schiller and Johann Wolfgang von Goethe plotted against each other.",
    "licence": "LGPL-3.0-or-later",
    "output": [
        "none"
    ],
    "mimetypes": [
        "text/csv",
        "application/vnd.google-earth.kml+xml",
        "application/vnd.google-earth.kmz",
        "application/vnd.dariahde.geobrowser.kml+xml",
        "application/vnd.dariahde.geobrowser.csv"
    ],
    "languages": [
        "eng",
        "generic"
    ],
    "langEncoding": "639-1",
    "parameters": {
        "input": "self.linkToResource"
    },
    "url": "https://geobrowser.de.dariah.eu/beta/"
}
