{
    "task": "Word sense disambiguation",
    "deployment": "production",
    "name": "WoSeDon",
    "logo": "clarin-pl.png",
    "homepage": "https://ws.clarin-pl.eu",
    "location": "Wroc≈Çaw, Poland",
    "creators": "Clarin-PL",
    "contact": {
        "person": "Tomasz Walkowiak",
        "email": "tomasz.walkowiak@pwr.edu.pl"
    },
    "version": "1.0",
    "licence": null,
    "authentication": "no",
    "description": "Word Sense Disambiguation for Polish texts based on plWordNet - the Polish wordnet (weakly supervised, for all words).",
    "languages": [
        "pol"
    ],
    "langEncoding": "639-1",
    "mimetypes": [
        "text/plain",
        "application/msword",
        "application/vnd.openxmlformats-officedocument.wordprocessingml.document",
        "application/vnd.openxmlformats-officedocument.presentationml.presentation",
        "application/vnd.openxmlformats-officedocument.spreadsheetml.sheet",
        "application/vnd.oasis.opendocument.text",
        "application/pdf",
        "text/html",
        "text/rtf"
    ],
    "output": [
        "application/xml"
    ],
    "url": "https://ws.clarin-pl.eu/weblicht.html",
    "parameters": {
        "input": null,
        "lang": "pl",
        "analysis": "wsd"
    }
}
