{
    "task": "Dependency Parsing",
    "deployment": "development",
    "name": "WebLicht Dep Parsing HR (RELDI)",
    "logo": "weblicht.jpg",
    "homepage": "https://weblicht.sfs.uni-tuebingen.de/weblichtwiki/index.php/Main_Page",
    "location": "Tuebingen, Germany",
    "creators": "CLARIN-D Centre at the University of Tuebingen, Germany",
    "contact": {
        "person": "CLARIN WebLicht Support",
        "email": "wlsupport@sfs.uni-tuebingen.de"
    },
    "version": "v1.0",
    "authentication": "Requires a CLARIN Service Provider Federation account, provided by many universities and institutions.",
    "licence": null,
    "description": "WebLicht Easy Chain for Dependency Parsing (Croatian). The easy-chain makes use of the RELDI software (see https://github.com/clarinsi), which tokenizes and lemmatizes the text, performs part-of-speech tagging, and subsequently, does dependency parsing. For RELDI specific inquiries, please contact nljubesi@gmail.com.",
    "languages": [
        "hrv"
    ],
    "langEncoding": "639-1",
    "mimetypes": [
        "text/plain",
        "text/rtf",
        "application/pdf",
        "application/msword",
        "application/vnd.openxmlformats-officedocument.wordprocessingml.document"
    ],
    "output": [
        "application/tcf+xml"
    ],
    "url": "https://weblicht.sfs.uni-tuebingen.de/weblicht/",
    "parameters": {
        "input": null,
        "lang": "hr",
        "analysis": "dep-parsing"
    }
}
