{
    "task": "Part-Of-Speech Tagging",
    "deployment": "production",
    "name": "Concraft",
    "logo": "zil.png",
    "homepage": "http://zil.ipipan.waw.pl/Concraft",
    "location": "Warsaw, Poland",
    "creators": "Institute of Computer Science, Polish Academy of Sciences, Poland",
    "contact": {
        "person": "MultiService",
        "email": "rjawor@amu.edu.pl"
    },
    "version": "v1.0",
    "authentication": "no",
    "licence": null,
    "description": "Morphosyntactic tagger for Polish based on constrained conditional random fields. Part of: Multiservice, a robust  linguistic Web service for Polish.",
    "languages": [
        "pol"
    ],
    "langEncoding": "639-1",
    "mimetypes": [
        "text/plain",
        "text/html"
    ],
    "output": [
        "application/json",
        "CoNLL format",
        "Visualization"
    ],
    "url": "http://multiservice.nlp.ipipan.waw.pl/en/clrs",
    "parameters": {
        "input": null,
        "analysis": "0"
    }
}
